{
  "advisory_id": "GHSA-aaaa-bbbb-cccc",
  "captured_at": "2026-06-18T05:00:00Z",
  "component": {
    "purl": "pkg:pypi/example-lib",
    "version": "1.4.2"
  },
  "disclosure_window": {
    "acknowledge_by": "2026-06-19T05:00:00Z",
    "disclose_by": "2026-07-16T05:00:00Z",
    "fix_by": "2026-07-02T05:00:00Z",
    "policy_ref": "policy.cvd@v1"
  },
  "id": "8c6c799f11f13ba5f24e9bc2f3674ab32a8cd474d2f8ad76368f0ced5bf587f2",
  "ref_viz": "viz.codebase_vuln_management@v1",
  "sbom_content_hash": "e3b0c44298fc1c149afbf4c8996fb92427ae41e4649b934ca495991b7852b855",
  "schema_version": "0.1.0",
  "severity": "high",
  "source_data": {
    "kind": "ocsf",
    "ocsf_class_uid": 2002
  },
  "stream": "codebase_vuln_management",
  "workflow_id": "codebase_vuln_management"
}
